,Biore Sarasara Uv Aqua Rich Waterly Essence Sunscreen 50g Spf50+ Pa+++ for Face and Body,Biore,9999999999999,Biore SARASARA UV Aqua Rich Waterly Essence Sunscreen 50g SPF50+ PA+++ for Face and Body.SPF50+ PA+++ sunscreen for face and Body.SPF is Water-base Wash off with regular Body.SPFsh fruit aroma,http://cdn4.fishpond.co.nz/watermark-toy-390x390.jpg,skin protection
,Biore SARASARA UV Daily Care Gel Sunscreen 120ml SPF28 PA++ for Body,Biore,4901301249128,Ideal for outdoor activities,http://rcdn-2.fishpond.co.nz/0030/221/757/159511120/6.jpeg,skin protection
,Biore Uv Perfect Face Milk Spf50 Lotion Sunscreen White 30ml.,Biore,8850900223823,BIORE UV Perfect Face Milk SPF50+ PA+++ (30ml) If you re looking for an affordable and effective sunblock  Biore UV Perfect Face Milk SPF 50+ PA+++ makes the mark.It s liquid based  being milky in texture but is ultra light leaving a sheer natural finish with no white residue nor sticky feel. Because Biore UV Perfect Face Milk SPF 50+ PA+++ containts sebum-absorbing powder to control oil and shine  skin actually feels powdery upon application. Yet  this sunblock does not clog up pores  works well as a makeup base with the face staying shine free for a good part of the day.-sticky feel. It has quite a pleasant fragrance but those who are allergic to alcohol in their skincare might want to avoid this product as it contains that.,http://rcdn-3.fishpond.co.nz/0030/222/378/159518398/6.jpeg,skin protection
,3x KAO Biore Uv Bright Sunblock Protection White Pink Blue Face Milk Spf 50 30ml,Biore,9999003204861,It has an ultra light  non-sticky texture. Also an ideal makeup base  it contains Sebum-absorbing powder to give you that matt look and keep skin shine-free . Apply the lotion daily on your face before being exposed to the sun. Every purchase from Customer-Satisfaction-Motto receive free gift tracking no,http://rcdn-4.fishpond.co.nz/0030/224/186/159539132/6.jpeg,skin protection
,Biore UV Tint Milk Facial Sunscreen SPF 30 Natural Colour 30ml,Biore,4710363816847,Superior lightweight UV block for face with a natural tint. Provides long-lasting UV protection of SPF30+/PA+++. It has an ultra light  non-sticky texture. Also an ideal makeup base  it contains Sebum-absorbing powder to give you that matt look and keep skin shine-free.,http://rcdn-2.fishpond.co.nz/0030/223/522/159530577/6.jpeg,skin protection
,Biore SARASARA UV Bright Face Milk BIHADA Sunscreen 30ml SPF50+ PA+++ for Face,Biore,4901301222817,Biore UV perfect face milk SPF 50 lotion sunscreen pink,http://rcdn-4.fishpond.co.nz/0030/221/297/159505050/6.jpeg,skin protection
,Biore Sarasara Uv Perfect Milk Waterproof Sunscreen 40ml Spf50+ Pa+++ for Face and Body,Biore,4901301747570,Long-lasting UV block for face and body. A UV block offering SPF50+/ PA+++ protection. Its water-proof and perspiration-resistant formulation makes it effective for outdoor protection. Ultra light and non-sticky texture spreads evenly on the skin  leaving a sheer  natural finish with no white residue.,http://rcdn-3.fishpond.co.nz/0030/221/712/159510479/6.jpeg,skin protection
,Biore UV Aqua Rich Watery Cream Whitening SPF50+ PA+++ 33g (Pack of 2),Biore,9999217507116,Biore UV Aqua Rich Watery Cream Whitening Sunscreen SPF50+ PA+++ 33g (Pack of 2),http://rcdn-2.fishpond.co.nz/0030/223/933/159536062/6.jpeg,skin protection
,2 Kao Biore Uv Protect Bright Sunblock Pink Face Milk Spf 50++ Sunscreen Lotion,Biore,9999999999999,Superior lightweight UV block for face  Radiant Effect. Provides SPF50+/ PA+++ UV protection. It has an ultra light and non-sticky texture. Also an ideal makeup base  it contains ultra fine light correction powder to cover pores  correct skin dullness and brighten skin tone to give you that radiant look! Ingredients : Cyclopentasiloxane  Dimethicone  Zinc Oxide  Alcohol  Water  Lauryl Methancrylate/ Sodium Methacrylate Crosspolymer  Ethylhexyl Methoxycinnamate  Tale  Glycerin  Styrene/ Stearyl Methacrylate Crosspolymer  Methicone  Polysillicone-9  PEG-12 Dimethicone  Titanium Dioxide  PEG-3 Dimethicone  Phenoxyethanol  Cetyl-PG Hydroxyethyl Palmitamide  Aluminium Hydroxide  Silica  Aluminium Dimeyristate  Iron Oxides  Barium Sulphate  Ci73360,http://rcdn-4.fishpond.co.nz/0030/223/014/159524001/6.jpeg,skin protection
,Biore Sarasara Uv Aqua Rich Waterly Essence Sunscreen 50g Spf50+ Pa+++ for Face and Body & Mini Tool Box (ml),Biore,9999999999999,Biore SARASARA UV Aqua Rich Waterly Essence Sunscreen 50g SPF50+ PA+++ for Face and Body.SPF50+ PA+++ sunscreen for face and body.It is Water-base Wash off with regular cleanser.Fresh fruit aroma Comes with Mini Tool Box Great for storing any miscellaneous items or your spare change. Overall dimensions: 11.4cm x 6.4cm x 7cm . Mini Tool Box is shipped from a separate warehouse and will arrive within a few days of your order.,http://rcdn-3.fishpond.co.nz/0030/223/445/159529506/6.jpeg,skin protection
,Biore Uv Bright Face Milk Spf50++ Sun Block Pink 30ml. Made in Thailand,Biore,9999999999999,Brand : BIORE Product Size : 30 ml. Condition : Brand new & Never used with a seal pack Biore UV Bright Face Milk SPF 50+/PA+++ Superior UV block with long-lasting protection against harmful UVA & UVB sunrays. PA+++ (30ml) Decription : Biore UV Bright Face Milk SPF 50+/PA+++ Superior UV block with long-lasting protection against harmful UVA & UVB sunrays. Also an ideal makeup base  it contains ultra fine light correction powder to cover pores  correct skin dullness and brighten skin tone to give you that radiant look! Biore Bright Face Milk  Foundation that brightly straightens skin the finish of is also beautiful. Strong infrared ray prevention severe sunlight is blocked for a long time. It has the face that doesn t want to burn  it is soaked  and defends. The skin is brightly straightened by the pores cover light correction powder mixing  and drinking pores are covered. The skin is smooth by can the use of the foundation to the beautiful make-up groundwork. The foundation finishes beautifully too. Transparent UV cutting powder (Ultra fine particle zinc oxide) mixing. It doesn t whiten. Optical correction powder mixing. It is bare skin smooth even if sweating. The colour of the non-perfume liquid is faintly pink .Radiant Effect .Non-sticky texture and does not clog pores .An ideal makeup base .Superior lightweight .Long-lasting UV protection of SPF50+/ PA+++ How to use : After cleansing in the morning  apply an amount of Face Milk on face and neck before sun exposure.,http://rcdn-3.fishpond.co.nz/0030/222/008/159514246/6.jpeg,skin protection
,KAO Biore Uv Perfect Face Milk Spf+50 Pa+++,Biore,9999999999999,Superior lightweight UV block for face  Matt Effect. Provides long-lasting UV protection of SPF50+/ PA+++. It has an ultra light  non-sticky texture. Also an ideal makeup base  it contains Sebum-absorbing powder to give you that matt look and keep skin shine-free.,http://rcdn-4.fishpond.co.nz/0043/270/674/160060240/6.jpeg,skin protection
,KAO Biore Uv Bright Face Milk Spf50+ Pa+++ 30ml,Biore,9999999999999,Superior lightweight UV block for face  Radiant Effect. Provides SPF50+/ PA+++ UV protection. It has an ultra light and non-sticky texture. Also an ideal makeup base  it contains ultra fine light correction powder to cover pores  correct skin dullness and brighten skin tone to give you that radiant look! Ingredients : Cyclopentasiloxane  Dimethicone  Zinc Oxide  Alcohol  Water  Lauryl Methancrylate/ Sodium Methacrylate Crosspolymer  Ethylhexyl Methoxycinnamate  Tale  Glycerin  Styrene/ Stearyl Methacrylate Crosspolymer  Methicone  Polysillicone-9  PEG-12 Dimethicone  Titanium Dioxide  PEG-3 Dimethicone  Phenoxyethanol  Cetyl-PG Hydroxyethyl Palmitamide  Aluminium Hydroxide  Silica  Aluminium Dimeyristate  Iron Oxides  Barium Sulphate  Ci73360,http://rcdn-4.fishpond.co.nz/0043/270/675/160060249/6.jpeg,skin protection