209,ซื้อ 1 แถม 1 Banana Boat Ultra Protect Sunscreen Lotion SPF50PA+++ (90mlx2pcs),Banana Boat,เหมาะสำหรับใช้ในทุกๆ วัน ช่วยกันความร้อนและปกป้องผิวจากการเผาไหม้ ของ แสงแดดได้สูงถึง 50 เท่า เนื้อโลชั่นบางเบาซึมซาบเร็ว ไม่เหนียวเหนอะหนะ,http://www.konvy.com/static/team/2016/0404/14597426796916.jpg,skin protection
210,แพ็คคู่ Banana Boat Sport Coolzone Sunscreen Lotion (170g x2),Banana Boat,SPF 50 PA+++ สเปรย์กันแดดสำหรับผู้ที่รักการเล่นกีฬากลางแจ้ง พร้อมปกป้องผิวด้วยเทคโนโลยี AvoTriplex ที่สามารถป้องกันรังสี UVA ได้อย่างดีเยี่ยม สูตรใหม่ซึมซาบสู่ผิวอย่างรวดเร็ว สัมผัสความเย็นสดชื่นทันทีที่ใช้งาน,http://www.konvy.com/static/team/2015/1104/14466300211661.jpg,skin protection
211,แพ็คคู่ Bananaboat Clear Mist Sun Comfort SPF50+PA+++ (170gx2),Banana Boat,เนื้อบางเบา ไม่เหนียวเหนอะหนะ กันน้ำ กันเหงื่อ ช่วยปกป้องผิวจากรังสี UVA และ UVB ด้วยค่า SPF50+PA+++,http://www.konvy.com/static/team/2017/0120/14848831403171_280x280.jpg,skin protection
212,ซื้อ 1 แถม 1 Banana Boat Sport Sunscreen Lotion SPF50+PA+++ (90mlx2pcs),Banana Boat,สูตรสำหรับการเล่นกีฬากลางแจ้งทุกชนิด เนื้อครีมบางเบาไม่เหนียวเหนอะหนะ ซึมซาบเร็ว ไม่อุดตันรูขุมขน ช่วยปกป้องผิวจากทั้งรังสียูวีเอและยูวีบี กันแดดได้ยาวนาน กันน้ำได้ดีเยี่ยม ผลิตภัณฑ์สูตรเดียวกับ Banana Boat Sport Sunscreen Lotion SPF 110 PA+++ ปรับเป็น SPF50+ ตามกฎข้อบังคับขององค์การอาหารและยา (อย.),http://www.konvy.com/static/team/2016/0426/14616371864112.jpg,skin protection
213,Banana Boat Sport Coolzone SPF50PA++++ Sunscreen Lotion 120ml,Banana Boat,โลชั่นกันแดดสูตรเย็นที่ออกแบบมาเฉพาะสำหรับผู้ที่ชื่นชอบการออกกำลังกายกลางแจ้ง มีค่ากันแดดสูงถึง 50 เท่า ปราศจากน้ำหอมที่อาจก่อให้เกิดการระคายเคือง,http://www.konvy.com/static/team/2016/0706/14677967151467.jpg,skin protection
214,แพ็คคู่ Banana Boat Ultra Mist Protect Sunscreen Lotion SPF50 (175ml x2),Banana Boat,ซึมซาบเร็วไม่เหนียวเหนอะหนะ ไม่อุดตันรูขุมขน,http://www.konvy.com/static/team/2015/1104/14466300032273.jpg,skin protection
215,Banana Boat Sport Coolzone Sunscreen Lotion 170g,Banana Boat,tantly Cools and Refreshes SPF 50 PA+++ สเปรย์กันแดดสำหรับผู้ที่รักการเล่นกีฬากลางแจ้ง พร้อมปกป้องผิวด้วยเทคโนโลยี AvoTriplex ที่สามารถป้องกันรังสี UVA ได้อย่างดีเยี่ยม สูตรใหม่ซึมซาบสู่ผิวอย่างรวดเร็ว สัมผัสความเย็นสดชื่นทันทีที่ใช้งาน,http://www.konvy.com/static/team/2015/1104/14466302064614.jpg,skin protection
216,ซื้อ 1 แถม 1 Banana Boat Sport Coolzone SPF50PA++++ Sunscreen Lotion(120ml×2),Banana Boat,โลชั่นกันแดดสูตรเย็นที่ออกแบบมาเฉพาะสำหรับผู้ที่ชื่นชอบการออกกำลังกายกลางแจ้ง มีค่ากันแดดสูงถึง 50 เท่า ปราศจากส่วนผสมของน้ำหอมที่อาจก่อให้เกิดการระคายเคืองต่อผิว ซึมซับเร็วไม่เหนียวเหนอะหนะ ปกป้องผิวจากรอยเหี่ยวย่นที่เกิดจากรังสี UVA กันน้ำ – กันเหงื่อยาวนาน,http://www.konvy.com/static/team/2015/1104/14466302408767.jpg,skin protection
217,ซื้อ1แถม1Banana Boat Natural Reflect Sunscreen Lotion SPF50,Banana Boat,ผิวหนังว่าอ่อนโยนแม้กับผิวที่เนียนและแพ้ง่ายของเด็กอ่อน ได้รับการแนะนำจากองค์การมะเร็งผิวหนัง,http://www.konvy.com/static/team/2015/1104/14466301015191.jpg,skin protection
218,Banana Boat Ultra Mist Protect Sunscreen Lotion SPF50 175ml,Banana Boat,ปกป้องผิวทุกวัน เนื้อสเปรย์ซึมซาบเร็วไม่เหนียวเหนอะหนะ ไม่อุดตันรูขุมขน,http://www.konvy.com/static/team/2015/1104/14466301545736.jpg,skin protection
219,BananaBoat Sport Coolzone Instantly Cools & Refreshes After Sun Gel 226g,Banana Boat,ฟื้นฟูผิวใส ด้วยความเย็นสุดขั้วจากเจลว่านหางจระเข้สด เนื้อเจลบางเบา ซึมง่าย เข้าช่วยบำรุงผิวให้เนียนนุ่มชุ่มชื่นอย่างล้ำลึก,http://www.konvy.com/static/team/2016/0426/14616372564073.jpg,skin protection
220,BananaBoat Sun Comfort Sunscreen Lotion SPF50 PA+++ 90ml,Banana Boat,โลชั่นกันแดดสำหรับปกป้องผิวทุกวัน เนื้อครีมบางเบาไม่เหนียวเหนอะหนะ ซึมซาบเร็วเพื่อตอบสนองคอนเซปต์    Fun in the Sun    สนุกสนานได้เต็มที่ภายใต้แสงแดด,http://www.konvy.com/static/team/2016/0602/14648363188680.jpg,skin protection
221,Bananaboat Clear Mist Sun Comfort SPF50+PA+++ 170g,Banana Boat,สเปรย์กันแดด เนื้อบางเบา ไม่เหนียวเหนอะหนะ กันน้ำ กันเหงื่อ ช่วยปกป้องผิวจากรังสี UVA และ UVB ด้วยค่า SPF50+PA+++,http://www.konvy.com/static/team/2017/0120/14848831794328_280x280.jpg,skin protection
222,Bananaboat Clear Ultra Mist Protect & Hydrate SPF50+PA+++ 170g,Banana Boat,สเปรย์กันแดด เนื้อบางเบา ไม่เหนียวเหนอะหนะ กันน้ำ กันเหงื่อ ช่วยปกป้องผิวจากแสงแดดด้วยค่า SPF50+PA+++,http://www.konvy.com/static/team/2017/0120/14848832919649_280x280.jpg,skin protection
223,แพ็คคู่ BananaBoat Sun Comfort Sunscreen Lotion SPF50 PA+++ (90mlx2),Banana Boat,สำหรับปกป้องผิวทุกวัน เนื้อครีมบางเบาไม่เหนียวเหนอะหนะ ซึมซาบเร็วเพื่อตอบสนองคอนเซปต์    Fun in the Sun    สนุกสนานได้เต็มที่ภายใต้แสงแดด,http://www.konvy.com/static/team/2016/0602/14648362821800.jpg,skin protection
224,Banana Boat Ultra Protect Sunscreen Lotion SPF50PA+++ 90ml,Banana Boat,ml โลชั่นกันแดดบานาน่าโบ๊ท เหมาะสำหรับใช้ในทุกๆ วัน ช่วยกันความร้อนและปกป้องผิวจากการเผาไหม้ ของ แสงแดดได้สูงถึง 50 เท่า เนื้อโลชั่นบางเบาซึมซาบเร็ว ไม่เหนียวเหนอะหนะ,http://www.konvy.com/static/team/2016/0614/14658918816721.jpg,skin protection
225,แพ็คคู่ Bananaboat Clear Ultra Mist Protect & Hydrate SPF50+PA+++ (170gx2),Banana Boat,เนื้อบางเบา ไม่เหนียวเหนอะหนะ กันน้ำ กันเหงื่อ ช่วยปกป้องผิวจากแสงแดดด้วยค่า SPF50+PA+++,http://www.konvy.com/static/team/2017/0120/14848832565135_280x280.jpg,skin protection
226,Banana Boat Ultra Protect Faces Sunscreen Lotion SPF 50 PA+++ 60ml,Banana Boat,โลชั่นกันแดดสำหรับปกป้องผิวหน้าสูตรใหม่จาก Banana Boat เนื้อครีมบางเบาซึมซาบเร็วปราศจากน้ำมันและน้ำหอมไม่อุดตันรูขุมขน ใช้ได้ทุกวัน (Daily Use),http://www.konvy.com/static/team/2015/1104/14466299489277.jpg,skin protection
227,ซื้อ 1 แถม 1 Banana Boat Sport Sunscreen Lotion SPF110PA+++ 90ml,Banana Boat,ทุกชนิดเนื้อครีมบางเบาไม่เหนียวเหนอะหนะ ซึมซาบเร็วไม่อุดตันรูขุมขน ช่วยปกป้องผิวจากการเผาไหม้ของแสงแดดถึง 110 เท่า พร้อมปกป้องทั้งรังสียูวีเอและยูวีบี กันแดดได้ยาวนาน กันน้ำได้ดีเยี่ยม,http://www.konvy.com/static/team/2015/1104/14466298896041.jpg,skin protection
228,ซื้อ1แถม1 Banana Boat Ultra Protect Sunscreen Lotion SPF80PA+++ 90ml,Banana Boat,านาน่าโบ๊ท เหมาะสำหรับใช้ในทุกๆ วัน ช่วยกันความร้อนและปกป้องผิวจากการเผาไหม้ ของ แสงแดดได้สูงถึง 80 เท่า เนื้อโลชั่นบางเบาซึมซาบเร็ว ไม่เหนียวเหนอะหนะ,http://www.konvy.com/static/team/2015/1104/14466301184895.jpg,skin protection
229,แพ็คคู่ Banana Boat Ultra Mist Sport Sunscreen Lotion SPF110,Banana Boat,ไม่เหนียวเหนอะหนะ อ่อนโยนต่อผิวที่บอบบางและแพ้ง่าย ไม่มีส่วนผสมของน้ำหอมหรือสารแต่งกลิ่น,http://www.konvy.com/static/team/2015/1104/14466299853083.jpg,skin protection
230,ซื้อ1แถม1Banana Boat Natural Reflect Baby Sunscreen Lotion SPF50++118ml (Baby),Banana Boat,ไม่ต้องเป็นกังวล ด้วยกันแดดที่อ่อนโยนไม่ต่างจากน้ำ ด้วยสารกันแดดจากธรรมชาติ 100%,http://www.konvy.com/static/team/2015/1104/14466300854379.jpg,skin protection
231,Banana Boat Ultra Mist Sport Sunscreen Lotion SPF110,Banana Boat,เหมาะสำหรับกิจกรรมกลางแจ้ง ไม่เหนียวเหนอะหนะ อ่อนโยนต่อผิวที่บอบบางและแพ้ง่าย ไม่มีส่วนผสมของน้ำหอมหรือสารแต่งกลิ่น,http://www.konvy.com/static/team/2015/1104/14466301384872.jpg,skin protection
232,Banana Boat Ultra Mist Sport Sunscreen Lotion SPF110 170g,Banana Boat,เหมาะกับกิจกรรมกลางแจ้ง ไม่เหนียวเหนอะหนะ อ่อนโยนต่อผิวที่บอบบางและแพ้ง่าย ไม่มีส่วนผสมของน้ำหอมหรือสารแต่งกลิ่น,http://www.konvy.com/static/team/2015/1104/14466300544364.jpg,skin protection
233,Banana Boat Ultra Mist Protect Sunscreen Lotion SPF50 175 ml.,Banana Boat,ปกป้องผิวทุกวัน เนื้อสเปรย์ซึมซาบเร็วไม่เหนียวเหนอะหนะ ไม่อุดตันรูขุมขน,http://www.konvy.com/static/team/2015/1104/14466300347692.jpg,skin protection
234,Banana Boat Natural Reflect Sunscreen Lotion SPF50,Banana Boat,ผ่านการทดสอบจากแพทย์ผิวหนังว่าอ่อนโยนแม้กับผิวที่เนียนและแพ้ง่ายของเด็กอ่อน,http://www.konvy.com/static/team/2015/1104/14466301928294.jpg,skin protection
235,Banana Boat Aloe Vera Gel 230g,Banana Boat,เจลทาผิว เจลใสบริสุทธิ์ ซึมลึกลงสู่ใต้ผิวชั้นใน ช่วยทดแทนความชุ่มชื้นที่หายไปหลังออกแดด ลดอาการแสบผิว ผิวลอก ในกรณีที่ผิวไหม้แดด ปลอบประโลมผิวที่เก็บกักความร้อนไว้ระหว่างออกแดดให้เย็นลง กลิ่นหอม บริสุทธิ์ ไม่เหนียวเหนอะหนะ และลดริ้วรอยแก่ก่อนวัย,http://www.konvy.com/static/team/2015/1104/14466298727946.jpg,skin protection
236,Banana Boat Natural Reflect Baby Sunscreen Lotion SPF50++90ml (Baby),Banana Boat,ผิวบอบบางแค่ไหน หรือแพ้ง่าย ก็ไม่ต้องเป็นกังวล ด้วยกันแดดที่อ่อนโยนไม่ต่างจากน้ำ ด้วยสารกันแดดจากธรรมชาติ 100%,http://www.konvy.com/static/team/2015/1104/14466301722315.jpg,skin protection
237,Banana Boat Sport Sunscreen Lotion SPF 50 PA+++ 90 ml,Banana Boat,โลชั่นกันแดดที่ออกแบบมาเฉพาะสำหรับผู้ที่ชื่นชอบการออกกำลังกายกลางแจ้ง มีค่ากันแดดสูงถึง 50 เท่า ช่วยป้องกันแสงแดด พร้อมทั้งปกป้องผิวไม่ให้เกิดริ้วรอยก่อนวัย,http://www.konvy.com/static/team/2015/1104/14466299055712.jpg,skin protection
238,Banana Boat Kids Sunscreen Lotion SPF50 90ml,Banana Boat,ปี ขึ้นไป หรือผู้มีผิวแพ้ง่าย อุดมไปด้วยอโลเวร่าและวิตามินอี ช่วยปกป้องผิวจากแสงแดดอย่างอ่อนโยนและให้ความชุ่มชื้นกับผิว ไม่ระคายเคืองตา ใช้ได้แม้ผิวบอบบางแพ้ง่าย พร้อมช่วยปกป้องผิวจากการเผาไหม้ของแสงแดดถึง 50 เท่า พร้อมปกป้องทั้งรังสียูวีเอและยูวีบี กันแดดได้ยาวนาน กันน้ำดีเยี่ยม,http://www.konvy.com/static/team/2015/1104/14466299659556.jpg,skin protection
239,Banana Boat Ultra Protect Sunscreen Lotion SPF50 240ml,Banana Boat,มสารบำรุงผิว aloe vera   vitamin C และ E,http://www.konvy.com/static/team/2015/1104/14466298298162.jpg,skin protection
