,Nars Velvet Matte Lip Pencil Duo,NARS,607845084259,What it is: A duo featuring two hot shades of the combination lipstick and lip pencil. What it does: Combining the convenience of a pencil with the application of a lipstick in a jumbo-sized crayon design  these pigment-rich sticks provide a matte  creamy finish that will not dry the lips. Enriched with emollients  vitamin E  and silicone  each gorgeous shade glides on and stays put. This set contains: - 2 x 0ml Velvet Matte Lip Pencil in Dolce Vita (dusty rose) and Cruella (scarlet red) What else you need to know: This product is an Allure Best of Beauty winner.,http://rcdn-2.fishpond.co.nz/0104/334/328/241516502/6.jpeg,lipstick
,NARS Lip Gloss ORGASM (.350ml) HALF SIZE,NARS,9999999999999,NARS Lip Gloss ORGASM (.350ml) HALF SIZE,http://rcdn-2.fishpond.co.nz/0063/239/007/181992773/6.jpeg,lipstick
,NARS Satin Lip Pencil Mandore (.210ml),NARS,607845092209,Buy NARS Lipsticks - NARS Satin Lip Pencil Mandore,http://rcdn-3.fishpond.co.nz/0130/237/233/275125249/6.jpeg,lipstick
,NARS Satin Lip Pencil  Rikugien,NARS,9999999999999,This season NARS  new Satin Lip Pencil dresses up lips in statement shades that seduce with rich  colour-bright pigments while drenching them in decadent moisture. A modern  long-wearing  vitamin-enriched formula in a jumbo pencil format to provide great wear and intense colour with a satin finish. Use for lining  all-over lip colour  or pairing with another lip product.,http://rcdn-2.fishpond.co.nz/0056/831/337/121211029/6.jpeg,lipstick
,Sephora NARS VIB: NARS Velvet Matte Lip Pencil in Cruella and NARS Satin Lip Pencil in Rikugien,NARS,607845238768,no,http://rcdn-3.fishpond.co.nz/0075/946/180/209666360/6.jpeg,lipstick
,NARS Pure Matte Lipstick - Montego Bay 5ml (3.4g),NARS,9999999999999,What it is : An ultra-matte  super-rich lipstick with the supple feel of a hydrating lip treatment. What it does : This matte lipstick moisturises and sooths lips while depositing vivid  dramatic colour onto the lips. What else you need to know : The formula includes mango butter at levels known to provide additional comfort and moisture. The product comes packaged in a new  soft-touch slim stick.,http://rcdn-3.fishpond.co.nz/0056/908/584/160138654/6.jpeg,lipstick
,NARS Sarah Moon Mind Game Velvet Lip Glide Set,NARS,607845084235,NARS Sarah Moon Mind Game Velvet Lip Glide Set. Bond  NO 675  Chez Claude  Unspeakable  Plato s  Toy.,http://rcdn-2.fishpond.co.nz/0127/891/640/269966001/6.jpeg,lipstick
,NARS Cosmetics Velvet Lip Glide - BOUND(Soft rose pink),NARS,9999999999999,no,http://rcdn-2.fishpond.co.nz/0133/123/592/284350292/6.jpeg,lipstick
,NARS Satin Lipstick  Afghan Red,NARS,9999999999999,A wide range of captivating shades designed to provide the look and style the colour dictates. NARS lipstick is available in three formulas.,http://rcdn-4.fishpond.co.nz/0023/044/541/157870763/6.jpeg,lipstick
,NARS Pure Matte Lipstick - Vesuvio - 2g/0ml,NARS,607845035060,no,http://rcdn-4.fishpond.co.nz/0034/008/812/159774702/6.jpeg,lipstick
,NARS Lip Liner Pencil  Marnie,NARS,9999999999999,Longwearing colour in a creamy formula that helps define  correct and shape the lips while preventing lip colour from bleeding and feathering. Available in colour-coordinated shades to correspond with lipstick hues.,http://rcdn-1.fishpond.co.nz/0023/044/687/97979854/6.jpeg,lipstick
,NARS Semi-Matte Lipstick  Catfight,NARS,9999142995422,A wide range of captivating shades designed to provide the look and style the colour dictates. NARS lipstick is available in three formulas.,http://rcdn-1.fishpond.co.nz/0023/387/799/23340064/6.jpeg,lipstick
,NARS Audacious Lipstick  BETTE (Bordeaux),NARS,9999999999999,Debut weightless  colour-saturated lips when you smooth on this NARS Audacious Lipstick. It glides on like satin across skin  and achieves single-stroke coverage that leaves lips with captivating colour.,http://rcdn-4.fishpond.co.nz/0067/014/934/191531559/6.jpeg,lipstick
,Christopher Kane for NARS Lip Gloss in Nucleus,NARS,607845056041,Nars Lip Gloss lavishes lips in a limited-edition shades. Nourishing ingredients moisturise  leaving lips smooth and soft  while the doe-foot applicator glides smoothly and offers comfort and precision for long-lasting wear. The limited-edition shades are perfect for subtle  everyday glamour  and were created in collaboration with top fashion designer Christopher Kane. The packaging features his signature shocking style.,http://rcdn-2.fishpond.co.nz/0066/673/277/190643554/6.jpeg,lipstick
,NARS Sheer Lipstick  Viva Las Vegas,NARS,707002049302,A wide range of captivating shades designed to provide the look and style the colour dictates. NARS lipstick is available in three formulas.,http://rcdn-1.fishpond.co.nz/0112/574/984/284236654/6.jpeg,lipstick
,NARS Velvet Gloss Lip Pencil  Frivolous,NARS,9999999999999,Gorgeously glossy  intensely hydrating. NARS takes everything beloved about its Velvet Matte Lip Pencil - the convenience of a pencil with the application of a lipstick in a jumbo-size crayon design - then swaps the matte formula for one that lends lips luminosity. Available in six beautifully glazed shades  the Velvet Gloss Lip Pencils feature a lightweight formula that is enriched with Vitamin E. plus a blend of moisture-rich hyaluronic spheres for a lustrous look thatÃ¢ÂÂs exceptionally rich. It doesnÃ¢ÂÂt get glossier than this.,http://rcdn-2.fishpond.co.nz/0030/480/350/158979009/6.jpeg,lipstick
,NARS Larger Than Life Lip Gloss  International Velvet,NARS,9999999999999,Outrageously lustrous colour meets high-impact shine. Dramatic  stay-in-place shades glide on smoothly and evenly for lips that are more luminous and voluminous than ever before.,http://rcdn-1.fishpond.co.nz/0062/400/696/197813477/6.jpeg,lipstick
,NARS The Multiple  Palm Beach,NARS,9999999999999,The original multi-purpose stick for eyes  cheeks  lips and body. Its unique  creamy formula blends effortlessly to provide sheer colour for creating shimmering accents  contours or dynamic highlights on all skin tones. Creates perfect  glowing complexions and is conveniently designed for failproof application,http://rcdn-4.fishpond.co.nz/0023/044/554/159765264/6.jpeg,lipstick
,Nars Lipstick - Tzigane 5ml,NARS,607845010937,Long lasting colour pigments have been suspended in this translucent formula to provide a sheer  natural tint. 5ml3.4g,http://rcdn-4.fishpond.co.nz/0030/488/235/160105280/6.jpeg,lipstick
,NARS Lip Gloss - Greek Holiday - 8g/10ml,NARS,120267026022,Provides luxurious shine & rich  sexy colour Available in sheer  semi-sheer & creamy formulas Colour stays true & long lasting Features a wand for convenient application Wear alone or over other lip products,http://rcdn-4.fishpond.co.nz/0030/481/761/159902690/6.jpeg,lipstick
,NARS Lip Gloss  Albatross,NARS,9999999999999,Serious shine and sexy colour in sheer  semi-sheer and creamy formulas. Extremely wearable and versatile shades may be worn alone or over other lip formulas for added dimension.,http://rcdn-4.fishpond.co.nz/0028/444/081/158258606/6.jpeg,lipstick
,NARS Sheer Lipstick  Autumn Leaves,NARS,9999999999999,A beautifully sheer formula infused with ingredients to improve the condition of the lips. Sheer  long lasting colour pigments have been suspended in this tranlucent formula to provide a sophisticated shine.,http://rcdn-2.fishpond.co.nz/0030/195/938/97974374/6.jpeg,lipstick
,NARS Lipstick - Liguria,NARS,607845093046,A beautifully sheer formula infused with ingredients to improve the condition of the lips. Sheer  long lasting colour pigments have been suspended in this tranlucent formula to provide a sophisticated shine.,http://rcdn-2.fishpond.co.nz/0063/920/968/183126599/6.jpeg,lipstick
,NARS Lip Gloss - Super Orgasm - 8g/10ml,NARS,9999999999999,Provides luxurious shine & rich  sexy colour Available in sheer  semi-sheer & creamy formulas Colour stays true & long lasting Features a wand for convenient application Wear alone or over other lip products,http://rcdn-4.fishpond.co.nz/0030/479/099/159929584/6.jpeg,lipstick
,Satin Lip Pencil - Isola Bella 2.2g0ml,NARS,786007190059,Satin Lip Pencil - Isola Bella,http://rcdn-4.fishpond.co.nz/0069/983/964/199212117/6.jpeg,lipstick
,Satin Lip Pencil - Biscayne Park 2.2g0ml,NARS,786018410139,Satin Lip Pencil - Biscayne Park,http://rcdn-2.fishpond.co.nz/0069/983/965/199214280/6.jpeg,lipstick
,Satin Lip Pencil - Majella 2.2g0ml,NARS,786036247250,Satin Lip Pencil - Majella,http://rcdn-2.fishpond.co.nz/0069/983/960/199219264/6.jpeg,lipstick
,Lip Gloss - Giza 8g10ml,NARS,630589036185,Provides luxurious shine & rich sexy colour Available in sheer semi-sheer & creamy formulas Colour stays true & long lasting Features a wand for convenient application Wear alone or over other lip products,http://rcdn-3.fishpond.co.nz/0070/589/622/200844401/6.jpeg,lipstick
,Lip Gloss - Turkish Delight 8g10ml,NARS,676846810075,Provides luxurious shine & rich sexy colour Available in sheer semi-sheer & creamy formulas Colour stays true & long lasting Features a wand for convenient application Wear alone or over other lip products,http://rcdn-3.fishpond.co.nz/0071/358/061/202587632/6.jpeg,lipstick
,NARS Brillant Lip Gloss  Bougainville,NARS,607845016540,A lip gloss that imparts intense colour and brilliant shine. Outrageously lustrous colour meets serious shine in this NARS gloss. Its stay-in-place dramatic shade glides on smoothly and evenly for lips that are more luminous and voluminous than ever before. Long-lasting  high-shine hues are infused with ingredients that nourish and fight free radicals while natural lip enhancers pump up with volume. A new  shorter bristle brush delivers the most precise application possible.,http://rcdn-4.fishpond.co.nz/0070/295/476/200086701/6.jpeg,lipstick
,Lip Pencil  More 1 ea,NARS,9999999999999,no,http://rcdn-3.fishpond.co.nz/0052/271/119/158953686/6.jpeg,lipstick
,NARS LIP GLOSS IN TURKISH DELIGHT 1619 FULL SIZE 10ml / 8 g IN RETAIL BOX,NARS,712478332629,A moisturising lip gloss that supports antiaging and imparts long-wearing  sophisticated shine and stunning colour for subtle  everyday glamour.,http://rcdn-3.fishpond.co.nz/0113/571/821/249720790/6.jpeg,lipstick
,Satin Lip Pencil - Hyde Park 2.2g0ml,NARS,786055055867,Satin Lip Pencil - Hyde Park,http://rcdn-3.fishpond.co.nz/0069/227/397/197207734/6.jpeg,lipstick
,NARS Lipstick - Afghan Red (Satin) - 3.4g/5ml,NARS,9999999999999,Provides wide range of creamy  silky colours Contains micro-bubble spheres that continually release lip conditioners Non-drying formula & extra long wearing Nourishing with vitamin E Makes your lips healthy & attractive,http://rcdn-1.fishpond.co.nz/0030/499/981/160240200/6.jpeg,lipstick
,Nars The Multiple - # Palm Beach - 14g/15ml,NARS,707002932857,Multi-function stick for eyes  cheeks  lips & body Effortlessly glides on with creamy texture Offers sheer  mistake-proof colour Instantly creates shiny accents  contours or highlights on skin Renders you a flawless  luminous complexions,http://rcdn-1.fishpond.co.nz/0036/630/227/160126290/6.jpeg,lipstick
,NARS ** GUY BOURDIN ** CINEMATIC LIPSTICK * # 9600 FULL FRONTAL ** 5ml,NARS,731642367878,NARS ** GUY BOURDIN ** CINEMATIC LIPSTICK * # 9600 FULL FRONTAL ** 5ml,http://rcdn-3.fishpond.co.nz/0069/630/970/198286772/6.jpeg,lipstick
,NARS Larger Than Life Lip Gloss  Spring Break,NARS,9999999999999,Colour: Spring Break 1327,http://rcdn-4.fishpond.co.nz/0095/943/104/237178123/6.jpeg,lipstick
,Lip Gloss (New Packaging) - #Striptease 6ml/0.18oz,NARS,9999999999999,Provides luxurious shine & rich sexy colour Available in sheer semi-sheer & creamy formulas Colour stays true & long lasting Features a wand for convenient application Can be worn alone or over other lip products,http://rcdn-3.fishpond.co.nz/0095/824/669/234505690/6.jpeg,lipstick
,NARS Lipstick - Manhunt (Sheer) - 3.4g/5ml,NARS,97389026028,Provides wide range of sheer  natural tint colours Translucent formula Contains micro-bubble spheres that continually release lip conditioners Non-drying formula & extra long wearing Nourishing with vitamin E,http://rcdn-4.fishpond.co.nz/0030/499/989/160240241/6.jpeg,lipstick
,NARS Lipstick - Mindgame (Sheer) - 3.4g/5ml,NARS,97391026023,Provides wide range of sheer  natural tint colours Translucent formula Contains micro-bubble spheres that continually release lip conditioners Non-drying formula & extra long wearing Nourishing with vitamin E,http://rcdn-2.fishpond.co.nz/0036/628/199/160164245/6.jpeg,lipstick
,NARS Velvet Lip Glide in Le Palace (TRAVEL SIZE),NARS,607845258155,Covetable comfort meets confident colour in a high-pigment formula that glides like a gloss  cloaks like a lipstick—and feels like nothing else. Semi-matte colour glides on a stays supple without drying or feeling sticky. Developed with Oil Infusion Complex  an innovative concentration of precious oils  fused to create a smooth-glide effect. Fully coats lips on contact with smooth  saturated  semi-matte style.,http://rcdn-4.fishpond.co.nz/0133/996/984/288092653/6.jpeg,lipstick
,NARS Lip Gloss # ANGELIKA 10ml / 8 g UNBOXED,NARS,607845916567,NARS Lip Gloss # ANGELIKA 10ml / 8 g NEW ITEM. UNBOXED (NO BOX). NEVER BEEN USED. 100% ORIGINAL. FAST FREE,http://rcdn-3.fishpond.co.nz/0136/066/810/296606870/6.jpeg,lipstick
,NARS Lip Gloss # WONDER 5ml / 7 g NEW UNBOXED,NARS,607845916611,NARS Lip Gloss # WONDER 5ml / 7 g NEW ITEM. UNBOXED (NO BOX). NEVER BEEN USED. 100% ORIGINAL. FAST FREE,http://rcdn-2.fishpond.co.nz/0136/066/809/296600557/6.jpeg,lipstick
,Lipstick - Niagara (Satin) 3.4g5ml,NARS,676789678916,Provides wide range of creamy silky colours Contains micro-bubble spheres that continually release lip conditioners Non-drying formula & extra long wearing Nourishing with vitamin E Makes your lips healthy & attractive,http://rcdn-3.fishpond.co.nz/0133/391/782/285421192/6.jpeg,lipstick
,Lip Gloss  Odalisque 0.19 oz (5.6 ml),NARS,9999999999999,Outrageously lustrous colour meets serious shine. Stay-in-place dramatic shade glides on smoothly and evenly for lips that are more luminous and voluminous than ever before. Long-lasting  high-shine hues are infused with ingredients to nourish and fight free radicals while natural lip enhancers pump up the volume. A new  shorter bristle brush delivers the most precise application possible. However you want to express yourself  Larger Than Life Lip Gloss says it boldly  brilliantly  brazenly.,http://rcdn-4.fishpond.co.nz/0068/237/861/194671903/6.jpeg,lipstick
,NARS Lipstick Tzigane 3.4g5ml,NARS,20548302602,Lipstick - Blonde Venus ( Satin ),http://rcdn-2.fishpond.co.nz/0129/449/597/272835985/6.jpeg,lipstick
,NARS Lipstick - Trans Siberian (Semi-Matte) - 3.4g/5ml,NARS,97365026028,Provides wide range of rich-pigmented matte colours Imparts a full-bodied  velvety finish on lips Contains micro-bubble spheres that continually release lip conditioners Non-drying formula & extra long wearing Nourishing with vitamin E,http://rcdn-1.fishpond.co.nz/0030/499/990/160130830/6.jpeg,lipstick
,NARS Lipstick - Senorita (Sheer) - 3.4g/5ml,NARS,97393026021,Provides wide range of sheer  natural tint colours Translucent formula Contains micro-bubble spheres that continually release lip conditioners Non-drying formula & extra long wearing Nourishing with vitamin E,http://rcdn-2.fishpond.co.nz/0030/498/207/160127365/6.jpeg,lipstick
,NARS Pure Matte Lipstick Tashkent 0ml,NARS,130841026027,NARS Pure Matte Lipstick  Tashkent,http://rcdn-1.fishpond.co.nz/0096/244/592/284236667/6.jpeg,lipstick
,NARS Lip Gloss - Greek Holiday 8g/10ml,NARS,607845016403,Nars - Lip Colour - Lip Gloss by Nars. Lip Gloss - Greek Holiday. 8g/10ml Provides luxurious shine & rich  sexy colour. Available in sheer  semi-sheer & creamy formulas. Colour stays true & long lasting. Features a wand for convenient application. Wear alone or over other lip products.,http://rcdn-2.fishpond.co.nz/0023/043/791/159752024/6.jpeg,lipstick
,NARS Lip Gloss - Belize 8g/10ml,NARS,607845016465,Nars - Lip Colour - Lip Gloss by Nars. Lip Gloss - Belize. 8g/10ml Provides luxurious shine & rich  sexy colour. Available in sheer  semi-sheer & creamy formulas. Colour stays true & long lasting. Features a wand for convenient application. Wear alone or over other lip products.,http://rcdn-2.fishpond.co.nz/0023/044/565/159752055/6.jpeg,lipstick
,NARS Ultra Smooth Lip Gloss Downtown Metallic Pink Lavender - 5ml (4gm),NARS,607845016526,Serious shine and sexy colour in sheer  semi-sheer and creamy formulas. Extremely wearable and versatile shades may be worn alone or over other lip formulas for added dimension. - Ultra-smooth  non-sticky  comfortable wear  - Enriched with Vitamin E to help lips feel supple and hydrated  - Iconic NARS shades,http://rcdn-4.fishpond.co.nz/0069/227/292/197209641/6.jpeg,lipstick
,NARS Lip Gloss - Chelsea Girls,NARS,607845016953,What it is: A moisturising  holiday lip gloss that supports antiaging and imparts long-wearing shine and eye-catching colour for subtle  everyday glamour. What it does: NARS limited-edition lip gloss shades are created for the Laced with Edge Holiday 2014 Collection.These innovative lip glosses amp up lips with luxe  shimmery shades  and they come packaged in the exclusive Laced with Edge packaging thats perfect for gifting. What else you need to know: Francois Nars projects a bold new design for the future feminine: cutting-edge colour that decodes the thrill of seduction. Size: 5ml,http://rcdn-3.fishpond.co.nz/0068/896/192/196348420/6.jpeg,lipstick
,NARS Lip Gloss - Baby Doll,NARS,607845016960,What it is: A moisturising  holiday lip gloss that supports antiaging and imparts long-wearing shine and eye-catching colour for subtle  everyday glamour. What it does: NARS limited-edition lip gloss shades are created for the Laced with Edge Holiday 2014 Collection.These innovative lip glosses amp up lips with luxe  shimmery shades  and they come packaged in the exclusive Laced with Edge packaging thats perfect for gifting. What else you need to know: Francois Nars projects a bold new design for the future feminine: cutting-edge colour that decodes the thrill of seduction. Size: 5ml,http://rcdn-1.fishpond.co.nz/0068/896/196/196343608/6.jpeg,lipstick
,Pure Sheer SPF 15 Lip Treatment - Angelique  1.7g/0ml,NARS,607845034117,no,http://rcdn-1.fishpond.co.nz/0023/044/639/97882192/6.jpeg,lipstick
,NARS Lip Gloss Christopher Kane - Mezmer,NARS,607845056027,NARS and Christopher Kane partnered to launch a limited-edition collection (neons and neutrals). Gloss features sheer  high-shine colour and smooth  comfortable wear for a pout that pops.,http://rcdn-2.fishpond.co.nz/0107/676/114/244486427/6.jpeg,lipstick
,NARS Lip Gloss Christopher Kane - Nebulous,NARS,607845056034,NARS and Christopher Kane partnered to launch a limited-edition collection (neons and neutrals). Gloss features sheer  high-shine colour and smooth  comfortable wear for a pout that pops.,http://rcdn-2.fishpond.co.nz/0107/676/115/244489377/6.jpeg,lipstick
,Lipliner Pencil - Miss Sadie  1.2g/0ml,NARS,607845090243,Helps define  correct & shape your lips Formulated with rich  intense pigments Gives velvety finish Prevents lip colour from bleeding & feathering Creamy texture & long wearing,http://rcdn-3.fishpond.co.nz/0022/818/058/22857676/6.jpeg,lipstick
,Lipliner Pencil - Miss Sadie 1.2g0ml,NARS,676082361676,Helps define correct & shape your lips Formulated with rich intense pigments Gives velvety finish Prevents lip colour from bleeding & feathering Creamy texture & long wearing,http://rcdn-2.fishpond.co.nz/0129/449/479/272838026/6.jpeg,lipstick
,NARS LARGER THAN LIFE LIP GLOSS IN BIMINI 1344 FULL SIZE 0.19 oz. / 6 ml IN RETAIL BOX,NARS,712478332681,This is a lip gloss that imparts intense colour and brilliant shine. Outrageously lustrous colour meets serious shine in this NARS gloss. Its stay-in-place dramatic shade glides on smoothly and evenly for lips that are more luminous and voluminous than ever before. Long-lasting  high-shine hues are infused with ingredients that nourish and fight free radicals while natural lip enhancers pump up with volume.,http://rcdn-4.fishpond.co.nz/0116/832/560/253306028/6.jpeg,lipstick
,NARS LARGER THAN LIFE LIP GLOSS In ODALISQUE 1321 (beige peach) FULL SIZE 0.19 oz. / 6 ml IN RETAIL BOX,NARS,712478332698,Nars Larger Than Life Lip Gloss In ODALISQUE (beige peach) Full Size 0.19 Oz. / 6 mL Brand New In Retail Box. Outrageously lustrous colour meets serious shine in this NARS gloss. Its stay-in-place dramatic shade glides on smoothly and evenly for lips that are more luminous and voluminous than ever before. Long-lasting  high-shine hues are infused with ingredients that nourish and fight free radicals while natural lip enhancers pump up with volume.,http://rcdn-2.fishpond.co.nz/0116/832/554/253305573/6.jpeg,lipstick
,LOT of 2 x NARS LARGER THAN LIFE LIP GLOSS In ODALISQUE 1321 (beige peach) FULL SIZE 0.19 oz. / 6 ml & IN RETAIL BOX - each,NARS,712478332704,This is a hydrating & high shine lip gloss. Features a fine texture that glides on evenly & smoothly. Provides intense long-lasting high-shine shade. Contains natural lip enhancers to pump up with volume. Hydrates lips & shields against free radical damage.,http://rcdn-4.fishpond.co.nz/0116/832/553/253306873/6.jpeg,lipstick
,Nars Pore & Shine Control Primer,NARS,721897921222,The unique French cosmetics brand Nars is releasing three new primers that will give makeup a new lease on life. With a targeted focus on reducing pores and making skin look clear and healthy  the Pore & Shine is infused with African whitewood and Oleaonolic with peptides that help balance the complexion. The primer has a softening quality that minimises pores  keeps shine under control and gives skin a matte quality.,http://rcdn-2.fishpond.co.nz/0136/722/715/299124487/6.jpeg,lipstick
,NARS Lip Gloss Brillant 0.12oz/4ml Half Size DLX Travel Size Baby Doll,NARS,737052071015,NARS Lip Gloss Brillant 0.12oz/4ml Half Size DLX Travel Size Baby Doll,http://rcdn-3.fishpond.co.nz/0122/940/421/259685182/6.jpeg,lipstick
,Lipstick - Hot Voodoo (Semi-Matte) 3.4g/5ml,NARS,9999999999999,Provides wide range of creamy  silky colours Contains micro-bubble spheres that continually release lip conditioners Non-drying formula & extra long wearing Nourishing with vitamin E Makes your lips healthy & attractive,http://rcdn-2.fishpond.co.nz/0036/627/841/160161078/6.jpeg,lipstick
,NARS Lipstick,NARS,9999999999999,,http://rcdn-3.fishpond.co.nz/0092/190/608/231012431/6.jpeg,lipstick
,NARS Lipstick - Morocco (Semi-Matte) 3.4g5ml,NARS,9999999999999,Provides wide range of creamy silky colours Contains micro-bubble spheres that continually release lip conditioners Non-drying formula & extra long wearing Nourishing with vitamin E Makes your lips healthy & attractive,http://rcdn-4.fishpond.co.nz/0071/358/463/202594161/6.jpeg,lipstick
,Nars Velvet Matte Lip Pencil --Walkyrie (Burnt Coral Red),NARS,9999999999999,no,http://rcdn-3.fishpond.co.nz/0133/123/617/284348164/6.jpeg,lipstick
,NARS BEautiful Life Lip and Cheek Palette,NARS,9999173148255,,http://rcdn-4.fishpond.co.nz/0092/190/828/231011755/6.jpeg,lipstick
,Nars Velvet Matte Lip Pencil --Consuming Red,NARS,9999999999999,no,http://rcdn-4.fishpond.co.nz/0133/123/618/284349011/6.jpeg,lipstick
,NARS Ultimate Lip pencil kit Biscayne Park /Stourhead /Sex Machine Full Size,NARS,9999999999999,The item will be shipped internationally with tracking service from Bangkok  Thailand. The lead time delivery to the US is 2-3 weeks. The item is 100% authentic and fresh in the most recent lot 2015.,http://rcdn-1.fishpond.co.nz/0066/673/613/190641606/6.jpeg,lipstick
,NARS Travel Size Larger Than Life Lipgloss - Blue Movie,NARS,9999999999999,NARS Travel Size Larger Than Life Lipgloss - Blue Movie,http://rcdn-3.fishpond.co.nz/0113/120/626/249357171/6.jpeg,lipstick
,Lip Gloss - Stella 8g/10ml,NARS,9999999999999,Provides luxurious shine & rich  sexy colour Available in sheer  semi-sheer & creamy formulas Colour stays true & long lasting Features a wand for convenient application Wear alone or over other lip products,http://rcdn-3.fishpond.co.nz/0039/674/457/160080438/6.jpeg,lipstick
,NARS Velvet Gloss Lip Pencil  Happy Days by NARS,NARS,797770807860,Pink coral infused with gold shimmer,http://rcdn-3.fishpond.co.nz/0066/673/351/190641618/6.jpeg,lipstick
,Lip Gloss (New Packaging) - #Eternal Red 6ml/0.18oz,NARS,827118379695,Provides luxurious shine & rich sexy colour Available in sheer semi-sheer & creamy formulas Colour stays true & long lasting Features a wand for convenient application Can be worn alone or over other lip products,http://rcdn-1.fishpond.co.nz/0115/788/345/252117152/6.jpeg,lipstick
,NARS by Lip Gloss - Triple X --8g10ml,NARS,987502093276,All the fragrances we carry are 100% genuine with a FULL,http://rcdn-3.fishpond.co.nz/0071/358/040/202588311/6.jpeg,lipstick
,NARS Lip Gloss,NARS,9999999999999,Colour: Greek Holiday - sparkling pink sandSize: One Size,http://rcdn-3.fishpond.co.nz/0062/401/164/179999772/6.jpeg,lipstick
,NARS Satin Lip Pencil,NARS,9999999999999,This season NARS  new Satin Lip Pencil dresses up lips in statement shades that seduce with rich  colour-bright pigments while drenching them in decadent moisture.,http://rcdn-3.fishpond.co.nz/0056/831/336/121211028/6.jpeg,lipstick
,NARS Velvet Gloss Lip Pencil 2.8G5ml Happy Days,NARS,9999999999999,This jumbo lip pencil provides glossy colorImparts luxurious shine to illuminate your lipsLightweight formula & comfortable to wearEnriched with Vitamin E plus a blend of moisturerich hyaluronic spheresGives superior hydration to make lips appear fullerLeaves an extra smooth  buttery feel on lips,http://rcdn-4.fishpond.co.nz/0114/676/581/251006334/6.jpeg,lipstick
