,Lip Gloss - Rose Gitane 8g/10ml,NARS,9999999999999,Provides luxurious shine & rich  sexy colour Available in sheer  semi-sheer & creamy formulas Colour stays true & long lasting Features a wand for convenient application Wear alone or over other lip products,http://rcdn-4.fishpond.co.nz/0039/674/213/160079656/6.jpeg,lipstick
,NARS Velvet Matte Duo Lip Pencli Cytere Soft Metallic Rose,NARS,9999999999999,,http://rcdn-1.fishpond.co.nz/0092/190/893/231012108/6.jpeg,lipstick
,NARS Velvet Matte Dou Lip Pencil Tender Night Lilac,NARS,9999999999999,,http://rcdn-4.fishpond.co.nz/0092/190/976/231011946/6.jpeg,lipstick
,NARS Lip Gloss  Albatross,NARS,9999999999999,Serious shine and sexy colour in sheer  semi-sheer and creamy formulas. Extremely wearable and versatile shades may be worn alone or over other lip formulas for added dimension.,http://rcdn-2.fishpond.co.nz/0022/818/030/158930889/6.jpeg,lipstick
,Lip Gloss - Giza 8g/10ml,NARS,9999999999999,Provides luxurious shine & rich  sexy colour Available in sheer  semi-sheer & creamy formulas Colour stays true & long lasting Features a wand for convenient application Wear alone or over other lip products,http://rcdn-1.fishpond.co.nz/0039/675/116/160082168/6.jpeg,lipstick
,NARS Satin Lip Pencil Yu,NARS,9999999999999,,http://rcdn-1.fishpond.co.nz/0092/190/635/231012441/6.jpeg,lipstick
,Nars Lip Gloss Priscilla,NARS,9999999999999,Grâce à son éventail complet de teintes éblouissantes  le Lip Gloss NARS offre une brillance intense longue tenue  uniforme et agréable pour un glamour subtil au quotidien. Pour quel type de ...,http://rcdn-4.fishpond.co.nz/0119/469/759/255885132/6.jpeg,lipstick
,Nars Velvet Matte Lip Pencil  Dolce Vita 5ml (2.44 G),NARS,9999999999999,no,http://rcdn-2.fishpond.co.nz/0067/459/430/192695907/6.jpeg,lipstick